{"automatic_assignment":false,"canonical_sha256":"8f92a9dfd224fdf3275a835caa14a8e04f5b03bf367d026520c28e2aa55a44e3","ffmpeg":{"executable_sha256":"bdf6aabffdba7411edff8d36c389d695257fcdf823d196020176e117612862f6","version":"ffmpeg version 8.0.1-3ubuntu2 Copyright (c) 2000-2025 the FFmpeg developers","version_report_sha256":"a85f002a2266c5bfd7a5d1e5c72d18a0f9e8e60fd941327fa9a093d931687c17"},"inspection":{"canonical_sha256":"acedc27184a7608cdbfe35be9bfde64747761621f14c51506ac4e8097c326b3e","container":{"duration":{"denominator":50,"numerator":17},"format":"matroska,webm","start":{"denominator":1,"numerator":0}},"decoded_frame_count":5,"ffprobe":{"executable_sha256":"a6dac1e9e8631e04075d06854cc4069308aec279bb04683b4a0bca5e4f54b2fe","version":"ffprobe version 8.0.1-3ubuntu2 Copyright (c) 2007-2025 the FFmpeg developers","version_report_sha256":"6be9b7e8ce3baebec8831a9010e04a658c036ad3dc9dcbd59be3b0c60c3acf70"},"frames":[{"best_effort_timestamp":0,"ordinal":0,"packet_dts":0,"picture_type":"I","pts":0},{"best_effort_timestamp":40,"ordinal":1,"packet_dts":40,"picture_type":"I","pts":40},{"best_effort_timestamp":120,"ordinal":2,"packet_dts":120,"picture_type":"I","pts":120},{"best_effort_timestamp":160,"ordinal":3,"packet_dts":160,"picture_type":"I","pts":160},{"best_effort_timestamp":300,"ordinal":4,"packet_dts":300,"picture_type":"I","pts":300}],"policy":"rsf.video-rgba-presentation/v1","schema":"rsf.video-inspection/v1","selected_stream":0,"source":{"sha256":"51f0173b6b4dfd615acf3cb9d55e8131dd87c28b8e528098668b9fefd4c53a9d","size":1180},"stream_selection":"ONLY_VIDEO_STREAM","streams":[{"avg_frame_rate":{"denominator":1,"numerator":25},"codec_name":"ffv1","coded_height":16,"coded_width":16,"color_range":"pc","color_space":"gbr","color_transfer":null,"duration_ts":null,"height":16,"index":0,"nb_frames":null,"pix_fmt":"bgr0","r_frame_rate":{"denominator":1,"numerator":25},"start_pts":0,"time_base":{"denominator":1000,"numerator":1},"width":16}],"time_base":{"denominator":1000,"numerator":1},"timing":"IRREGULAR_PTS"},"items":[{"best_effort_timestamp":300,"has_transparency":false,"height":16,"mode":"RGBA","order":0,"ordinal":4,"png_sha256":"1c5c3e4c120ee8a2861bf12636a1b96344f578171f7543869ea4a8b437883382","pts":300,"requested":300,"rgba_sha256":"f8630b2a2e8ecb0f293bbd525fad3d6961c8b33c50a098e85568997bb5409c6f","size":125,"time_base":{"denominator":1000,"numerator":1},"transparency_kind":"OPAQUE","width":16},{"best_effort_timestamp":0,"has_transparency":false,"height":16,"mode":"RGBA","order":1,"ordinal":0,"png_sha256":"dde9003e6bd1bca8db19eaeb40b24733bbbf4dac8a934f0314cbc4b96f780ef9","pts":0,"requested":0,"rgba_sha256":"adf63562c07856fcfc2564a135d54d4de89c0ef0136f6c6fc197611515874631","size":118,"time_base":{"denominator":1000,"numerator":1},"transparency_kind":"OPAQUE","width":16},{"best_effort_timestamp":120,"has_transparency":false,"height":16,"mode":"RGBA","order":2,"ordinal":2,"png_sha256":"3e00777e379eecd20d3385f45bcd00b3d85d525d45c50318cbc0634f3f6f8989","pts":120,"requested":120,"rgba_sha256":"4de13be716c171641092c025d6821c7ffe597e95c207e95a055c11838a0bc94f","size":120,"time_base":{"denominator":1000,"numerator":1},"transparency_kind":"OPAQUE","width":16}],"policy":"rsf.video-rgba-presentation/v1","request":{"autorotate":false,"decoder_threads":1,"mode":"pts","ordering":"REQUEST_ORDER","output":"RGBA8_PNG_BITEXACT","stream":0,"synchronization":"PASSTHROUGH","timestamp_policy":"EXACT_SOURCE_PTS_ONLY","values":[300,0,120]},"schema":"rsf.video-candidates/v1","visual_review":"UNVERIFIED"}
